id,course_name,provider,description,course_status,pricing,duration_in_hours,rating,reviews,best_of_all_time,url
0,CS50's Introduction to Computer Science,edX,An introduction to the intellectual enterprises of computer science and the art of programming.,On-Demand,Free Online Course (Audit),144,4.5,198,1,https://www.classcentral.com/course/computer-science-harvard-university-cs50-s-introd-442
1,Harvard CS50 – Full Computer Science University Course,freeCodeCamp,"Learn the basics of computer science from Harvard University. This is CS50, an introduction to the intellectual enterprises of computer science and the art of programming.",On-Demand,Free Video,24,4.5,865,0,https://www.classcentral.com/classroom/freecodecamp-harvard-cs50-full-computer-science-university-course-119762
2,Introduction to Computer Science and Programming Using Python,edX,An introduction to computer science as a tool to solve real-world analytical problems using Python 3.5.,On-Demand,Free Online Course (Audit),135,4.5,131,1,https://www.classcentral.com/course/computer-science-massachusetts-institute-of-techn-1341
3,Introduction to Electrical Engineering and Computer Science I,MIT OpenCourseWare,"This course provides an integrated introduction to electrical engineering and computer science, taught using substantial laboratory experiments with mobile robots.",On-Demand,Free Video,17,4.5,49,0,https://www.classcentral.com/classroom/mit-ocw-6-01sc-introduction-to-electrical-engineering-and-computer-science-i-spring-2011-40932
4,CS50's Computer Science for Business Professionals,edX,This is CS50’s introduction to computer science for business professionals.,On-Demand,Free Online Course (Audit),24,5,21,0,https://www.classcentral.com/course/computer-science-harvard-university-cs50-s-comput-10143
5,"Internet History, Technology, and Security",Coursera,"This course will open up the Internet and show you how it was created, who created it and how it works. Along the way we will meet many of the innovators who developed the Internet and Web technologies that we use today.",On-Demand,Free Online Course (Audit),15,4.5,42,1,https://www.classcentral.com/course/insidetheinternet-335
6,Computer Science 101,edX,Introduction to Computer Science for a zero-prior-experience audience. Play with little phrases of code to understand what computers are all about.,On-Demand,Free Online Course (Audit),30,4,19,0,https://www.classcentral.com/course/computer-science-stanford-university-computer-sci-2175
7,Computational Social Science Methods,Coursera,"Explore computational social science's impact on society, covering data science, machine learning, social networks, and simulations. Gain insights into digital footprints and emerging social patterns.",On-Demand,Free Online Course (Audit),11.33333333,4.5,139,1,https://www.classcentral.com/course/computational-social-science-methods-17299
8,Functional Programming Principles in Scala,Coursera,In this course you will discover the elements of the functional programming style and learn how to apply them usefully in your daily programming tasks.,On-Demand,Free Online Course (Audit),56,4.5,65,1,https://www.classcentral.com/course/progfun-422
9,Build a Modern Computer from First Principles: From Nand to Tetris (Project-Centered Course),Coursera,"Hands-on journey to build a modern computer system from logic gates to a functioning general-purpose computer, covering hardware, machine language, and assembly.",On-Demand,Free Online Course (Audit),44,5,28,1,https://www.classcentral.com/course/build-a-computer-3234
10,Computer Simulations,Coursera,"Explore complex social phenomena through computer simulations. Learn to create and analyze agent-based models, combining hypothetical scenarios with real-world data to study and improve societal systems.",On-Demand,Free Online Course (Audit),12.81666667,5,52,0,https://www.classcentral.com/course/computer-simulations-17986
11,Introduction to Computer Science and Programming in Python,MIT OpenCourseWare,The course is intended for students with little or no programming experience. It aims to provide students with an understanding of the role computation can play in solving problems and to help students.,On-Demand,Free Video,10,4.5,7,0,https://www.classcentral.com/classroom/mit-ocw-6-0001-introduction-to-computer-science-and-programming-in-python-fall-2016-40930
12,An Introduction to Logic for Computer Science,Coursera,"Explore propositional logic fundamentals and applications in computer science, enhancing problem-solving skills through hands-on exercises and real-world examples.",On-Demand,Free Online Course (Audit),7.3,4.5,9,0,https://www.classcentral.com/course/an-introduction-to-logic-in-computer-science-202050
13,CS50's Computer Science for Lawyers,edX,"This course is a variant of Harvard University's introduction to computer science, CS50, designed especially for lawyers (and law students).",On-Demand,Free Online Course (Audit),45,5,8,0,https://www.classcentral.com/course/computer-science-harvard-university-cs50-s-comput-16857
14,Computational Social Science Capstone Project,Coursera,"Integrative lab applying computational social science skills: web scraping, network analysis, NLP, and agent-based modeling to analyze social media data and simulate idea diffusion.",On-Demand,Free Online Course (Audit),13.63333333,4.5,34,0,https://www.classcentral.com/course/css-capstone-17985
15,CSS Variable Secrets - Harnessing the Full Power of Custom Properties,YouTube,"Unlock the full potential of CSS custom properties with expert tips, tricks, and gotchas. Gain a deeper understanding and refresh your CSS toolbox in this interactive journey from practical to cutting-edge techniques.",On-Demand,Free Video,0.983333333,0,0,0,https://www.classcentral.com/classroom/youtube-css-variable-secrets-lea-verou-css-day-2022-251302
16,Machine Learning - Lecture 2,YouTube,"Explore machine learning fundamentals, focusing on linear regression, gradient descent, and model evaluation techniques for predictive analysis and data-driven decision making.",On-Demand,Free Video,2.95,0,0,0,https://www.classcentral.com/classroom/youtube-csep-546-lecture-2-253881
17,"CSS Position Deep Dive - Understanding Static, Relative, Absolute, Fixed, and Sticky",YouTube,"Comprehensive exploration of CSS positioning properties, covering static, relative, absolute, fixed, and sticky, with practical examples and insights into containing blocks and potential pitfalls.",On-Demand,Free Video,0.466666667,0,0,0,https://www.classcentral.com/classroom/youtube-css-position-deep-dive-270048
18,CSS Art Crash Course - By Example,YouTube,"Learn to create simple illustrations using HTML and CSS techniques, exploring CSS art through hands-on examples and step-by-step guidance.",On-Demand,Free Video,0.433333333,0,0,0,https://www.classcentral.com/classroom/youtube-css-art-crash-course-by-example-153825
19,You Probably Want Position- Sticky Instead of Fixed,YouTube,"Explore the differences between position: fixed and sticky in CSS, with practical examples and creative use cases for sticky positioning in web design.",On-Demand,Free Video,0.266666667,0,0,0,https://www.classcentral.com/classroom/youtube-you-probably-want-position-sticky-instead-of-fixed-182684
20,CSS Background Values: Space and Round - Enhancing Image Repetition,YouTube,"Discover lesser-known CSS background values: space and round. Learn their unique behaviors, browser support, and practical applications to enhance your web designs.",On-Demand,Free Video,0.25,0,0,0,https://www.classcentral.com/classroom/youtube-the-background-values-no-one-knows-about-283689
21,Creating a Cool Bubble Zoom Effect with CSS,YouTube,"Learn to create an engaging bubble zoom effect using CSS, including grid animations, avatar scaling, and transition delays for a dynamic and interactive design.",On-Demand,Free Video,0.316666667,0,0,0,https://www.classcentral.com/classroom/youtube-create-a-cool-bubble-zoom-effect-with-css-286145
22,Cloning CSS Day Effect Using Modern CSS,YouTube,"Learn to recreate a fun CSS effect from CSS Day using modern techniques. Explore grid layouts, image positioning, and hover effects to enhance your web design skills.",On-Demand,Free Video,0.433333333,0,0,0,https://www.classcentral.com/classroom/youtube-can-i-clone-this-fun-effect-from-css-day-using-modern-css-284430
23,Start Over-Engineering Your CSS - Benefits and Techniques,YouTube,"Explore the benefits of embracing complexity in CSS solutions, deepening understanding and creating robust alternatives to simple approaches.",On-Demand,Free Video,0.833333333,0,0,0,https://www.classcentral.com/classroom/youtube-start-over-engineering-your-css-kevin-powell-css-day-2024-303428
24,Simple Details and Summary Animation with Pure CSS,YouTube,"Master modern CSS techniques to create smooth animations for details/summary elements, exploring interpolate-size and pseudo-elements for enhanced user interactions.",On-Demand,Free Video,0.216666667,0,0,0,https://www.classcentral.com/classroom/youtube-at-last-simple-details-summary-animation-with-pure-css-364940
25,Solving CSS Battles - Live Coding and Problem-Solving,YouTube,"Watch a live CSS problem-solving session as the instructor tackles complex challenges on CSS Battles, demonstrating effective techniques and thought processes for mastering advanced CSS skills.",On-Demand,Free Video,0.466666667,0,0,0,https://www.classcentral.com/classroom/youtube-am-i-good-enough-to-solve-these-css-battles-305230
26,Master CSS Overflow and Text Wrapping Techniques for Senior Developers,YouTube,"Discover advanced CSS overflow and text wrapping techniques, including lesser-known properties like overflow-anchor, word-break, and line-clamp, to enhance your web development skills.",On-Demand,Free Video,0.35,0,0,0,https://www.classcentral.com/classroom/youtube-master-css-overflow-text-wrapping-like-a-senior-developer-305232
27,7 CSS Responsive Sizing Features You Should Know,YouTube,"Discover 7 essential CSS responsive sizing features for optimal element sizing and layout control, enhancing your web design skills and site functionality.",On-Demand,Free Video,0.216666667,0,0,0,https://www.classcentral.com/classroom/youtube-you-should-know-these-7-css-responsive-sizing-features-305239
28,CSS Popover and Anchor Positioning Tutorial - Creating Dynamic Element Connections,YouTube,"Master CSS anchor positioning and popover functionality to create dynamic, position-aware elements with modern techniques and polyfills for cross-browser compatibility and smooth animations.",On-Demand,Free Video,0.35,0,0,0,https://www.classcentral.com/classroom/youtube-css-popover-anchor-positioning-is-magical-381454
29,Creating a Rotating Gradient Border Effect with CSS,YouTube,"Master CSS gradient animations by recreating a rotating, blurred border effect with conic gradients, masks, and pseudo-elements. Learn advanced techniques for creating dynamic visual effects through practical implementation.",On-Demand,Free Video,0.383333333,0,0,0,https://www.classcentral.com/classroom/youtube-can-i-clone-this-rotating-gradient-inner-glow-effect-385872
30,Top 5 Front-End Development Tips - From Console.log to Modern CSS,YouTube,"Discover essential front-end development tricks, from CSS debugging techniques and dynamic favicons to advanced number input handling and modern CSS functions like min() for more efficient coding.",On-Demand,Free Video,0.366666667,0,0,0,https://www.classcentral.com/classroom/youtube-my-top-5-most-popular-front-end-tips-355430
31,CSS @scope: Simplifying Naming and Specificity Management,YouTube,"Explore @scope in CSS: simplify naming, manage specificity, and enhance style organization. Learn its benefits, usage, and potential challenges in this comprehensive guide.",On-Demand,Free Video,0.433333333,0,0,0,https://www.classcentral.com/classroom/youtube-naming-things-just-got-easier-thanks-to-atscope-296147
32,5 Common CSS Mistakes Beginners Should Avoid,YouTube,"Learn to avoid common CSS pitfalls, including collapsing margins, overusing positioning, and misusing flexbox/grid. Gain insights on best practices for efficient and effective styling.",On-Demand,Free Video,0.366666667,0,0,0,https://www.classcentral.com/classroom/youtube-avoid-these-5-beginner-css-mistakes-292458
33,Transitioning To and From Display: None in CSS,YouTube,"Learn to smoothly animate elements between visible and hidden states using CSS transitions and the new @starting-style rule, with tips on browser support and best practices.",On-Demand,Free Video,0.35,0,0,0,https://www.classcentral.com/classroom/youtube-we-can-now-transition-to-and-from-display-none-294992
34,@property - One of the Coolest New CSS Features,YouTube,"Explore the revolutionary @property CSS feature, its potential impact, and how to effectively implement it in your web development projects.",On-Demand,Free Video,0.183333333,0,0,0,https://www.classcentral.com/classroom/youtube-atproperty-is-one-of-the-coolest-new-css-features-312517
35,Dynamic Numbering with CSS Counters,YouTube,"Explore dynamic numbering with CSS counters, from basic implementation to advanced techniques. Learn to create, increment, and customize counters for enhanced web design.",On-Demand,Free Video,0.2,0,0,0,https://www.classcentral.com/classroom/youtube-dynamic-numbering-with-css-counters-328838
36,Creating Discord's CSS-Only Search Input Animation Tutorial,YouTube,"Master the creation of Discord's elegant search input animation using pure CSS, including width transitions and icon transformations for an enhanced user interface.",On-Demand,Free Video,0.3,0,0,0,https://www.classcentral.com/classroom/youtube-discord-made-the-coolest-css-only-input-animation-410452
37,Understanding Flexbox Alignment - Main and Cross Axis Explained,YouTube,"Demystifies flexbox alignment, explaining main and cross-axis concepts, flex-direction changes, and practical tips for effective CSS layout using justify-content and align-items.",On-Demand,Free Video,0.233333333,0,0,0,https://www.classcentral.com/classroom/youtube-the-easy-way-to-understand-flexbox-alignment-308330
38,Pure CSS Scroll Spy Table of Contents - No JavaScript Required,YouTube,Master the creation of JavaScript-free scroll spy navigation using pure CSS techniques to build dynamic table of contents that automatically track user position on webpages.,On-Demand,Free Video,0.683333333,0,0,0,https://www.classcentral.com/classroom/youtube-pure-css-scroll-spy-table-of-contents-no-javascript-required-422959
39,Mastering CSS Colors: From Color Gamuts to Advanced Color Functions,YouTube,"Master advanced CSS color techniques, from color spaces and gamuts to relative colors and color mixing functions. Elevate your styling capabilities with modern color manipulation methods.",On-Demand,Free Video,0.35,0,0,0,https://www.classcentral.com/classroom/youtube-how-to-handle-css-colors-like-a-senior-dev-413218
40,Creating Overlapping Website Sections with CSS - Box Shadow and Gradient Methods,YouTube,Master CSS techniques for creating overlapping website sections using box-shadow and gradient methods in this practical web design tutorial.,On-Demand,Free Video,0.183333333,0,0,0,https://www.classcentral.com/classroom/youtube-easily-create-overlapping-sections-on-a-website-417487
41,Creating a Focus by Negation Effect with CSS - Animation Tutorial,YouTube,"Master CSS animation techniques to create an engaging ""focus by negation"" effect, exploring scaling, springiness, mobile optimization, and transform properties for dynamic user interactions.",On-Demand,Free Video,0.533333333,0,0,0,https://www.classcentral.com/classroom/youtube-create-a-super-fun-focus-by-negation-effect-428545
42,The Most Important CSS Update We've Seen in a Long Time,YouTube,"Explore the groundbreaking ""reading-flow"" CSS feature that enhances grid and flexbox element ordering, with Kevin Powell examining its potential impact and implementation before its official release.",On-Demand,Free Video,2.816666667,0,0,0,https://www.classcentral.com/classroom/youtube-the-most-important-css-update-we-ve-seen-in-a-long-time-454193
43,New CSS Features to Know for 2025,YouTube,"Discover upcoming CSS features for 2025, including custom selects, carousels, mixins, anchor positioning, view transitions, and more, plus newly available and widely supported capabilities.",On-Demand,Free Video,0.55,0,0,0,https://www.classcentral.com/classroom/youtube-new-css-features-to-know-for-2025-445402
44,5 CSS Tips Every Developer Should Know,YouTube,"Discover 5 essential CSS techniques: single-color gradients, user-select property, the all property, masks, and containing blocks for scroll containers, with practical examples and use cases.",On-Demand,Free Video,0.433333333,0,0,0,https://www.classcentral.com/classroom/youtube-5-css-tips-every-developer-should-know-450431
45,Create This Trendy Blurry Glass Effect with CSS,YouTube,"Master the trendy blurry glass effect using CSS backdrop-filter, gradients, and transparency techniques to create modern, elegant UI components.",On-Demand,Free Video,0.316666667,0,0,0,https://www.classcentral.com/classroom/youtube-create-this-trendy-blurry-glass-effect-with-css-459856
46,Spice Up Your Site with Quick and Easy Theme Transitions,YouTube,"Master CSS view transitions to create smooth, engaging theme switches with sliding, bouncing, and circle effects in just 13 minutes.",On-Demand,Free Video,0.216666667,0,0,0,https://www.classcentral.com/classroom/youtube-spice-up-your-site-with-quick-easy-theme-transitions-472229
47,Introduction to Computer Vision,Udacity,"This course provides an introduction to computer vision including fundamentals, methods for application and machine learning classification.",On-Demand,Free Online Course,2688,4.5,7,0,https://www.classcentral.com/course/udacity-introduction-to-computer-vision-1022
48,AP Computer Science A: Java Programming,edX,"Learn Java programming fundamentals, including variables, selection, and object-oriented design. Develop problem-solving skills and explore computer science concepts relevant to the AP Computer Science A exam.",On-Demand,Free Online Course (Audit),63,0,0,0,https://www.classcentral.com/course/java-purdue-university-ap-computer-science-a-java-6541
49,Machine Learning with Python,Coursera,"Dive into Machine Learning with Python, covering supervised and unsupervised learning, regression, classification, and clustering. Gain hands-on experience using SciPy and scikit-learn libraries.",On-Demand,Free Online Course (Audit),20.03333333,0,17601,0,https://www.classcentral.com/course/machine-learning-with-python-11714
50,System Administration and IT Infrastructure Services,Coursera,"Learn to manage IT infrastructure, cloud resources, servers, and users. Explore disaster recovery, backup strategies, and best practices for hardware and service selection. Gain practical skills for effective systems administration.",On-Demand,Free Online Course (Audit),24.08333333,0,26122,0,https://www.classcentral.com/course/system-administration-it-infrastructure--10219
51,The Web Developer Bootcamp 2025,Udemy,Udemy,On-Demand,Paid Course,74.11666667,0,281720,0,https://www.classcentral.com/course/udemy-the-web-developer-bootcamp-25316
52,Python - Intro to Computer Science - Harvard's CS50 (2018),freeCodeCamp,freeCodeCamp,On-Demand,Free Video,1.5,4.5,2,0,https://www.classcentral.com/classroom/freecodecamp-python-intro-to-computer-science-harvard-s-cs50-2018-105071
53,Advanced Operating Systems,Udacity,"In this course, we will see all the advances that have led to the state-of-the-art operating system that we know today, covering variety of platforms -- cell phones, multi-core, parallel systems, distributed systems, and cloud computing.",On-Demand,Free Online Course,840,5,6,0,https://www.classcentral.com/course/udacity-advanced-operating-systems-1016
54,Introducción a la programación en C: Instrucciones de control y ficheros de texto,edX,"En este curso aprenderás sobre condicionales, bucles y ficheros de texto en el lenguaje de programación C, uno de los más utilizados.",On-Demand,Free Online Course (Audit),20,4.5,7,0,https://www.classcentral.com/course/c-programming-universidad-autonoma-de-madrid-intr-12157
55,"Machine Learning A-Z: AI, Python & R + ChatGPT Prize [2025]",Udemy,Udemy,On-Demand,Paid Course,42.75,0,197874,0,https://www.classcentral.com/course/udemy-machinelearning-23826
56,Linux Command Line Basics,Udacity,Udacity,On-Demand,Free Online Course,168,4,10,0,https://www.classcentral.com/course/udacity-linux-command-line-basics-4049
57,Data Structures - Intro to Computer Science - Harvard's CS50 (2018),freeCodeCamp,freeCodeCamp,On-Demand,Free Video,2.5,5,1,0,https://www.classcentral.com/classroom/freecodecamp-data-structures-intro-to-computer-science-harvard-s-cs50-2018-105073
58,C Programming Language - Intro to Computer Science - Harvard's CS50 (2018),freeCodeCamp,freeCodeCamp,On-Demand,Free Video,2.5,4,1,0,https://www.classcentral.com/classroom/freecodecamp-c-programming-language-intro-to-computer-science-harvard-s-cs50-2018-105076
59,Data Structures and Performance,Coursera,"Explore data structures and algorithms for efficient handling of large datasets. Learn asymptotic analysis, linked lists, trees, and hashtables to improve program performance and flexibility.",On-Demand,Free Online Course (Audit),41.56666667,4,6,0,https://www.classcentral.com/course/data-structures-optimizing-performance-4203
60,Frontend Development Course - Create a Blog with HTML & CSS,freeCodeCamp,freeCodeCamp,On-Demand,Free Video,2.5,4.5,16,0,https://www.classcentral.com/classroom/freecodecamp-frontend-development-course-create-a-blog-with-html-css-104859
61,Behavioral Interview Practice for Computer Science Students,CodeSignal,CodeSignal,On-Demand,Free Certificate,0,0,49,0,https://www.classcentral.com/course/codesignal-behavioral-interview-practice-for-computer-science-students-361289
62,Trial Lessons: Philosophy and Computer Science,edX,"Explore the intersection of philosophy and computer science through seven concise lectures, covering topics from AI governance to robot rights in this unique master's program preview.",On-Demand,Free Online Course (Audit),2.5,0,0,0,https://www.classcentral.com/course/philosophy-ethics-university-of-bayreuth-trial-le-353497
63,Code of Life – When Computer Science Meets Genetics,openHPI,,On-Demand,Free Online Course,1008,0,0,0,https://www.classcentral.com/course/openhpi-code-of-life-when-computer-science-meets-genetics-5151
64,Complete Intro to Computer Science,Frontend Masters,Frontend Masters,On-Demand,Paid Course,8.5,0,0,0,https://www.classcentral.com/course/frontend-masters-complete-intro-to-computer-science-118012
65,SQL - Intro to Computer Science - Harvard's CS50 (2018),freeCodeCamp,freeCodeCamp,On-Demand,Free Video,1.5,0,0,0,https://www.classcentral.com/classroom/freecodecamp-sql-intro-to-computer-science-harvard-s-cs50-2018-105069
66,"HTTP, HTML, CSS - Intro to Computer Science - Harvard's CS50 (2018)",freeCodeCamp,freeCodeCamp,On-Demand,Free Video,1.5,0,0,0,https://www.classcentral.com/classroom/freecodecamp-http-html-css-intro-to-computer-science-harvard-s-cs50-2018-105072
67,Data Structures - Computer Science Course for Beginners,freeCodeCamp,freeCodeCamp,On-Demand,Free Video,2.5,0,0,0,https://www.classcentral.com/classroom/freecodecamp-data-structures-computer-science-course-for-beginners-104990
68,Online Computer Science Degree,Zero To Mastery,Zero To Mastery,On-Demand,Paid Course,280,0,0,0,https://www.classcentral.com/course/zero-to-mastery-online-computer-science-degree-468016
69,Executive Briefing: Artificial Intelligence (AI) + ChatGPT,Udemy,Udemy,On-Demand,Paid Course,2,0,153530,0,https://www.classcentral.com/course/udemy-executive-briefing-artificial-intelligence-38992
70,Introduction to Machine Learning with TensorFlow,Udacity,Introduction to Machine Learning with TensorFlow,On-Demand,Paid Course,1756.4,5,5,0,https://www.classcentral.com/course/udacity-intro-to-machine-learning-with-tensorflow-nanodegree--nd230-18190
71,Machine Learning with Python,freeCodeCamp,freeCodeCamp,On-Demand,Free Certificate,300,4.5,15,0,https://www.classcentral.com/course/freecodecamp-machine-learning-with-python-34068
72,The Complete Prompt Engineering for AI Bootcamp (2025),Udemy,Udemy,On-Demand,Paid Course,22.7,0,72194,0,https://www.classcentral.com/course/udemy-prompt-engineering-for-ai-261279
73,Cybersecurity and Its Ten Domains,Coursera,"Comprehensive introduction to cybersecurity covering ten domains, including governance, compliance, cryptography, network security, and more. Suitable for beginners and professionals seeking foundational knowledge.",On-Demand,Free Online Course (Audit),23.95,3,9,0,https://www.classcentral.com/course/ksucybersec-3206
74,ChatGPT: Complete ChatGPT Course For Work 2025 (Ethically)!,Udemy,Udemy,On-Demand,Paid Course,10.31666667,0,115167,0,https://www.classcentral.com/course/udemy-chatgpt-complete-chatgpt-course-for-work-2023-ethically-chat-gpt-131252
75,Kubernetes for the Absolute Beginners - Hands-on,Udemy,Udemy,On-Demand,Paid Course,6.566666667,0,101770,0,https://www.classcentral.com/course/udemy-learn-kubernetes-25011
76,Curso Completo de Computación con Windows,Udemy,Udemy,On-Demand,Paid Course,27.68333333,0,887,0,https://www.classcentral.com/course/udemy-curso-completo-de-fundamentos-de-computacion-68292
77,Introduction to Service Management with ITIL 4,Udemy,Udemy,On-Demand,Paid Course,1.766666667,0,92823,0,https://www.classcentral.com/course/udemy-service-management-itil-4-23418
