id,course_name,provider,description,course_status,pricing,duration_in_hours,rating,reviews,best_of_all_time,url
727,Choosing the Right CSS Unit - A Flowchart Guide,YouTube,"Comprehensive guide to selecting appropriate CSS units, covering positioning, font sizes, spacing, and layout. Includes a practical flowchart and in-depth explanations for various scenarios.",On-Demand,Free Video,0.316666667,0,0,0,https://www.classcentral.com/classroom/youtube-this-flowchart-will-help-you-pick-the-right-css-unit-270899
728,"Creating a Clean, Modern Navigation with HTML and CSS",YouTube,"Learn to create a modern, clean navigation using HTML and CSS, with step-by-step guidance on layout, styling, and animation techniques for an enhanced user interface.",On-Demand,Free Video,0.416666667,0,0,0,https://www.classcentral.com/classroom/youtube-create-a-clean-modern-navigation-with-html-css-277165
729,Build Custom Interfaces Using CSS Open Props,YouTube,"Discover how to create stunning interfaces and animations using CSS Open Props, a versatile design system. Learn implementation techniques, color management, and advanced features like gradients and masks.",On-Demand,Free Video,1.516666667,0,0,0,https://www.classcentral.com/classroom/youtube-build-custom-interfaces-using-css-open-props-193189
730,"CSS Fonts, Text and Color Properties - Tutorial 19",YouTube,"Explore CSS fonts, text, and color properties to enhance web design. Learn about font styles, line height, letter spacing, text decorations, and color implementation for visually appealing websites.",On-Demand,Free Video,0.533333333,0,0,0,https://www.classcentral.com/classroom/youtube-css-fonts-text-color-properties-sigma-web-development-course-tutorial-19-261315
731,True Parallax with CSS-Only - Creating Scroll-Based Animations,YouTube,"Learn to create true parallax effects using CSS-only techniques, leveraging scroll-timeline for complete control over layer speeds without JavaScript. Explore HTML setup, CSS stacking, and animation application.",On-Demand,Free Video,0.3,0,0,0,https://www.classcentral.com/classroom/youtube-true-parallax-with-css-only-is-now-possible-263595
732,Creative CSS Layout - Modern Techniques and Tools,YouTube,"Explore modern CSS layout techniques, including flexbox, Grid, aspect-ratio, and logical properties. Learn creative solutions for common challenges and upcoming features like subgrid and container queries.",On-Demand,Free Video,0.85,0,0,0,https://www.classcentral.com/classroom/youtube-creative-css-layout-michelle-barker-css-day-2022-251296
733,Fundamentals of Digital Image and Video Processing,Coursera,"Learn to process digital images and videos using mathematical frameworks and state-of-the-art techniques. Covers enhancement, recovery, compression, and segmentation, with emphasis on practical applications and modern tools.",On-Demand,Free Online Course (Audit),36,4.5,5,0,https://www.classcentral.com/course/digital-724
734,Web Development By Doing: HTML / CSS From Scratch,Udemy,Udemy,On-Demand,Free Online Course,1.183333333,0,13487,0,https://www.classcentral.com/course/udemy-web-development-learn-by-doing-html5-css3-from-scratch-introductory-61194
735,ChatGPT & Generative AI - The Complete Guide,Udemy,Udemy,On-Demand,Paid Course,21.46666667,0,25642,0,https://www.classcentral.com/course/udemy-chatgpt-bard-bing-complete-guide-to-chatgpt-openai-apis-205517
736,ServiceNow ITSM Processes,Udemy,Udemy,On-Demand,Paid Course,2.15,0,25071,0,https://www.classcentral.com/course/udemy-itsm-processes-applied-in-servicenow-from-0-to-hero-88623
737,AI for Clinical Trials and Precision Medicine - Ruishan Liu,YouTube,"Explores AI's potential to enhance clinical trial efficiency and generate precision medicine hypotheses, focusing on inclusive trial designs and quantifying cancer therapy effectiveness for specific mutations.",On-Demand,Free Video,0.933333333,5,10,0,https://www.classcentral.com/classroom/youtube-ai-for-clinical-trials-and-precision-medicine-ruishan-liu-132489
738,Deep Learning Prerequisites: The Numpy Stack in Python (V2+),Udemy,Udemy,On-Demand,Paid Course,6.283333333,0,22049,0,https://www.classcentral.com/course/udemy-deep-learning-prerequisites-the-numpy-stack-in-python-61169
739,"Blockchain A-Z: Build a Blockchain, a Crypto + ChatGPT Prize",Udemy,Udemy,On-Demand,Paid Course,14.66666667,0,22887,0,https://www.classcentral.com/course/udemy-build-your-blockchain-az-67830
740,Software Development Process,Udacity,"Software Development Processes explores requirements engineering, architecture and design, testing, and software quality in general.",On-Demand,Free Online Course,2016,3.5,5,0,https://www.classcentral.com/course/udacity-software-development-process-2335
741,"50 Projects In 50 Days - HTML, CSS & JavaScript",Udemy,Udemy,On-Demand,Paid Course,19.03333333,0,12508,0,https://www.classcentral.com/course/udemy-50-projects-50-days-26897
742,The Complete ServiceNow System Administrator Course,Udemy,Udemy,On-Demand,Paid Course,10.83333333,0,21805,0,https://www.classcentral.com/course/udemy-the-complete-servicenow-system-administrato-67697
743,Artificial Intelligence & Machine Learning for Business,Udemy,Udemy,On-Demand,Paid Course,5.716666667,0,21667,0,https://www.classcentral.com/course/udemy-artificial-intelligence-machine-learning-business-42479
744,Bash Scripting and Shell Programming (Linux Command Line),Udemy,Udemy,On-Demand,Paid Course,2.566666667,0,20900,0,https://www.classcentral.com/course/udemy-bash-scripting-25071
745,6.00x: Introduction to Computer Science and Programming,edX,6.00x is an introduction to using computation to solve real problems. The course is aimed at students with little or no prior programming experience who have a desire (or at least a need) to understand computational approaches to problem solving.,Finished,Free Online Course (Audit),1344,4.5,11,0,https://www.classcentral.com/course/edx-6-00x-introduction-to-computer-science-and-programming-446
746,Introduction to Large Language Models,Google Cloud Skills Boost,"Explore large language models, their applications, and prompt tuning techniques. Learn to develop Gen AI apps using Google tools in this concise introduction.",On-Demand,Free Certificate,1,4.5,11,0,https://www.classcentral.com/course/introduction-to-large-language-models-199879
747,"ChatGPT for Marketing, Content, Social Media, and PR",Udemy,Udemy,On-Demand,Paid Course,1.116666667,0,19978,0,https://www.classcentral.com/course/udemy-chatgpt-marketing-content-socialmedia-pr-emails-403548
748,Introduction to networking for complete beginners,Udemy,Udemy,On-Demand,Free Online Course,1.766666667,0,17720,0,https://www.classcentral.com/course/udemy-introduction-to-networking-for-complete-beg-26390
749,NLP - Natural Language Processing with Python,Udemy,Udemy,On-Demand,Paid Course,11.41666667,0,19011,0,https://www.classcentral.com/course/udemy-nlp-natural-language-processing-with-python-23329
750,"Jenkins, From Zero To Hero: Become a DevOps Jenkins Master",Udemy,Udemy,On-Demand,Paid Course,10.78333333,0,18533,0,https://www.classcentral.com/course/udemy-jenkins-from-zero-to-hero-23843
751,Introduction to Continuous Integration & Continuous Delivery,Udemy,Udemy,On-Demand,Paid Course,2.3,0,19297,0,https://www.classcentral.com/course/udemy-introduction-to-continuous-integration-and-continuous-delivery-88819
752,DevOps Project 1 - CI/CD with Git Jenkins Ansible Kubernetes,Udemy,Udemy,On-Demand,Paid Course,6.316666667,0,18379,0,https://www.classcentral.com/course/udemy-valaxy-devops-68716
753,Linux for Beginners,Udemy,Udemy,On-Demand,Paid Course,7.933333333,0,18556,0,https://www.classcentral.com/course/udemy-linuxforbeginners-25037
754,ChatGPT for IT Workers,Udemy,Udemy,On-Demand,Paid Course,4.633333333,0,18559,0,https://www.classcentral.com/course/udemy-chatgpt-for-it-workers-291133
755,Building Web Applications in PHP,Coursera,"Explore web application structure, request/response cycle, HTML, PHP basics, CSS, and database integration. Gain practical skills for dynamic web development.",On-Demand,Free Online Course (Audit),30.66666667,0,4304,0,https://www.classcentral.com/course/web-applications-php-9566
756,Practical PHP: Master the Basics and Code Dynamic Websites,Udemy,Udemy,On-Demand,Free Online Course,6.333333333,0,16304,0,https://www.classcentral.com/course/udemy-code-dynamic-websites-26948
757,Complete Guide to TensorFlow for Deep Learning with Python,Udemy,Udemy,On-Demand,Paid Course,14.16666667,0,17022,0,https://www.classcentral.com/course/udemy-complete-guide-to-tensorflow-for-deep-learn-24754
758,The Complete Front-End Web Development Course,Udemy,Udemy,On-Demand,Paid Course,16.81666667,0,14439,0,https://www.classcentral.com/course/udemy-front-end-web-development-25220
759,Learn DevOps: CI/CD with Jenkins using Pipelines and Docker,Udemy,Udemy,On-Demand,Paid Course,4.683333333,0,16885,0,https://www.classcentral.com/course/udemy-learn-devops-ci-cd-with-jenkins-using-pipel-23389
760,"70-461, 761: Querying Microsoft SQL Server with Transact-SQL",Udemy,Udemy,On-Demand,Paid Course,28.61666667,0,16865,0,https://www.classcentral.com/course/udemy-70-461-session-2-querying-microsoft-sql-server-2012-32909
761,OpenShift for the Absolute Beginners,Udemy,Udemy,On-Demand,Paid Course,4.666666667,0,16519,0,https://www.classcentral.com/course/udemy-learn-openshift-35872
762,Learn DevOps: The Complete Kubernetes Course,Udemy,Udemy,On-Demand,Paid Course,14.75,0,16169,0,https://www.classcentral.com/course/udemy-learn-devops-the-complete-kubernetes-course-67224
763,数据结构基础,Coursera,"掌握经典数据结构和算法,运用于解决实际问题。学习线性表、栈队列、树图等,培养程序设计和结构层次设计能力,为成为优秀程序员打基础。",On-Demand,Free Online Course (Audit),40,0,251,0,https://www.classcentral.com/course/spdsalgo-2761
764,"Generative AI, from GANs to CLIP, with Python and Pytorch",Udemy,Udemy,On-Demand,Paid Course,11.46666667,0,16285,0,https://www.classcentral.com/course/udemy-generative-creative-ai-from-gans-to-clip-with-python-and-pytorch-55591
765,"UX & Web Design Master Course: Strategy, Design, Development",Udemy,Udemy,On-Demand,Paid Course,23.21666667,0,15784,0,https://www.classcentral.com/course/udemy-ux-web-design-master-course-strategy-design-66761
766,Introduction to Machine Learning for Data Science,Udemy,Udemy,On-Demand,Paid Course,5.55,0,15767,0,https://www.classcentral.com/course/udemy-machine-learning-for-data-science-23333
767,Hardware,YouTube,"Comprehensive guide to building a computer from scratch, covering hardware components, assembly, and Windows installation for software developers.",On-Demand,Free Video,2.5,0,0,0,https://www.classcentral.com/classroom/youtube-hardware-92210
768,Foundation of Scientific Computing,YouTube,"Explore the fundamentals of scientific computing through a comprehensive series of lectures, covering essential concepts and techniques for computational problem-solving in scientific research.",On-Demand,Free Video,24,0,0,0,https://www.classcentral.com/classroom/youtube-foundation-of-scientific-computing-92358
769,Learning from Data (Introductory Machine Learning course),Independent,Independent,On-Demand,Free Online Course,1680,4.5,0,0,https://www.classcentral.com/university/caltech
770,Linux Shell Scripting: A Project-Based Approach to Learning,Udemy,Udemy,On-Demand,Paid Course,12.28333333,0,15255,0,https://www.classcentral.com/course/udemy-linux-shell-scripting-projects-23965
771,Maven Crash Course,Udemy,Udemy,On-Demand,Paid Course,6.283333333,0,15491,0,https://www.classcentral.com/course/udemy-mavencrashcourse-66861
772,Docker Crash Course for busy DevOps and Developers,Udemy,Udemy,On-Demand,Paid Course,3.233333333,0,15538,0,https://www.classcentral.com/course/udemy-docker-tutorial-for-devops-run-docker-containers-24194
773,Data Structures A-Z : Data Structures + Algorithms Bootcamp,Udemy,Udemy,On-Demand,Paid Course,7.733333333,0,15455,0,https://www.classcentral.com/course/udemy-data-structures-and-algorithms-the-complete-guide-32482
774,Build Websites from Scratch with HTML & CSS,Udemy,Udemy,On-Demand,Paid Course,8.633333333,0,15157,0,https://www.classcentral.com/course/udemy-build-website-scratch-26895
775,"Complete Data Science,Machine Learning,DL,NLP Bootcamp",Udemy,Udemy,On-Demand,Paid Course,99.16666667,0,15024,0,https://www.classcentral.com/course/udemy-complete-machine-learning-nlp-bootcamp-mlops-deployment-299595
776,How to use Artificial Intelligence - A guide for everyone!,Udemy,Udemy,On-Demand,Paid Course,1.5,0,15313,0,https://www.classcentral.com/course/udemy-how-to-use-artificial-intelligence-a-guide--285658
777,"DevOps: CI/CD with Jenkins pipelines, Maven, Gradle",Udemy,Udemy,On-Demand,Paid Course,3.45,0,15129,0,https://www.classcentral.com/course/udemy-devops-and-continuous-integration-with-jenkins-pipelines-27342
778,Bash Shell Scripting: Crash Course For Beginners,Udemy,Udemy,On-Demand,Paid Course,5.433333333,0,15099,0,https://www.classcentral.com/course/udemy-bash-shell-scripting-crash-course-for-begin-24246
779,Ultimate Web Designer & Web Developer Course,Udemy,Udemy,On-Demand,Paid Course,35.08333333,0,14643,0,https://www.classcentral.com/course/udemy-web-developer-course-25214
780,Introduction to Computer Networks for Non-Techies,Udemy,Udemy,On-Demand,Paid Course,18.71666667,0,14240,0,https://www.classcentral.com/course/udemy-introduction-to-computer-networks-25010
781,IT Troubleshooting Skill Training,Udemy,Udemy,On-Demand,Paid Course,1.616666667,0,14359,0,https://www.classcentral.com/course/udemy-it-troubleshooting-159214
782,Active Directory & Group Policy Lab,Udemy,Udemy,On-Demand,Paid Course,7.166666667,0,13926,0,https://www.classcentral.com/course/udemy-active-directory-group-policy-2012-26458
783,Python Data Structures & Algorithms + LEETCODE Exercises,Udemy,Udemy,On-Demand,Paid Course,10.03333333,0,13755,0,https://www.classcentral.com/course/udemy-data-structures-algorithms-python-70209
784,Standard 9.1- Part 1 Foundation Enterprise Architect Course,Udemy,Udemy,On-Demand,Paid Course,10.36666667,0,13807,0,https://www.classcentral.com/course/udemy-togaf-enterprise-architect-35256
785,ChatGPT Prompt Writing: The Complete Guide,Udemy,Udemy,On-Demand,Paid Course,11.3,0,13898,0,https://www.classcentral.com/course/udemy-chatgpt-4-291135
786,Cloud Computing Concepts: Part 2,Coursera,"Explore distributed computing concepts for cloud systems, including MapReduce, NoSQL, scalability, and trending areas. Implement core techniques in C++ through hands-on exercises.",On-Demand,Free Online Course (Audit),20,4.5,6,0,https://www.classcentral.com/course/cloudcomputing2-2942
787,Data Integration Fundamentals,Udemy,Udemy,On-Demand,Paid Course,3.8,0,13826,0,https://www.classcentral.com/course/udemy-data-integration-fundamentals-121670
788,[2025] Tensorflow 2: Deep Learning & Artificial Intelligence,Udemy,Udemy,On-Demand,Paid Course,26.4,0,13479,0,https://www.classcentral.com/course/udemy-deep-learning-tensorflow-2-23809
789,"LLM Engineering: Master AI, Large Language Models & Agents",Udemy,Udemy,On-Demand,Paid Course,25.28333333,0,13139,0,https://www.classcentral.com/course/udemy-llm-engineering-master-ai-and-large-language-models-405111
790,Identity and Access Management (IAM),Udemy,Udemy,On-Demand,Paid Course,7.183333333,0,13328,0,https://www.classcentral.com/course/udemy-identity-and-access-management-iam-69223
791,"Beginner Full Stack Web Development: HTML, CSS, React & Node",Udemy,Udemy,On-Demand,Paid Course,31.46666667,0,12806,0,https://www.classcentral.com/course/udemy-ultimate-web-32085
792,Complete web development course,Udemy,Udemy,On-Demand,Paid Course,79.53333333,0,12925,0,https://www.classcentral.com/course/udemy-web-dev-master-377494
793,"ChatGPT, Midjourney, ChatGPT 4, & DallE - The AI Bible",Udemy,Udemy,On-Demand,Paid Course,11.13333333,0,12972,0,https://www.classcentral.com/course/udemy-ai-bible-chatgpt-openai-api-dalle-bard-midjourney-gpt4-294854
794,What Is Generative AI?,LinkedIn Learning,LinkedIn Learning,On-Demand,Free Trial Available,1.066666667,0,104611,0,https://www.classcentral.com/course/linkedin-learning-what-is-generative-ai-300706
795,Mastering the System Design Interview,Udemy,Udemy,On-Demand,Paid Course,5.216666667,0,12422,0,https://www.classcentral.com/course/udemy-system-design-interview-prep-70526
796,Foundations of Front-End Web Development,Udemy,Udemy,On-Demand,Free Online Course,20.76666667,0,11429,0,https://www.classcentral.com/course/udemy-foundations-of-front-end-development-32089
797,Web Development Masterclass - Online Certification Course,Udemy,Udemy,On-Demand,Paid Course,26.05,0,10177,0,https://www.classcentral.com/course/udemy-web-development-masterclass-complete-certificate-course-25222
798,CURSO de CSS desde CERO,Udemy,Udemy,On-Demand,Free Online Course,1.433333333,0,453,0,https://www.classcentral.com/course/udemy-curso-de-css-desde-cero-a-experto-avanzado-69965
799,Active Directory on Windows Server,Udemy,Udemy,On-Demand,Paid Course,6.933333333,0,12561,0,https://www.classcentral.com/course/udemy-active-directory-on-windows-server-2016-31909
800,Python for Computer Vision with OpenCV and Deep Learning,Udemy,Udemy,On-Demand,Paid Course,14.08333333,0,12374,0,https://www.classcentral.com/course/udemy-python-for-computer-vision-with-opencv-and--25078
801,Microsoft Windows Server 2016 Training for Beginners,Udemy,Udemy,On-Demand,Paid Course,6.733333333,0,12261,0,https://www.classcentral.com/course/udemy-windows-server-2016-26457
802,Informatica PowerCenter - Beginner to Expert Level,Udemy,Udemy,On-Demand,Paid Course,19.46666667,0,12281,0,https://www.classcentral.com/course/udemy-informatica-powercenter-961-beginners-to-advanced-42564
803,Programming for Kids and Beginners: Learn to Code in Scratch,Udemy,Udemy,On-Demand,Paid Course,7.633333333,0,12315,0,https://www.classcentral.com/course/udemy-programming-for-kids-67336
804,TensorFlow for Deep Learning Bootcamp,Udemy,Udemy,On-Demand,Paid Course,62.95,0,12046,0,https://www.classcentral.com/course/udemy-tensorflow-developer-certificate-machine-learning-zero-to-mastery-46255
805,Aprende CSS para dar estilo a tus páginas WEB,Udemy,Udemy,On-Demand,Free Online Course,20.46666667,0,442,0,https://www.classcentral.com/course/udemy-aprende-css-para-dar-estilo-a-tus-paginas-w-68191
806,Complete VMWare vSphere ESXi and vCenter Administration,Udemy,Udemy,On-Demand,Paid Course,11.28333333,0,11856,0,https://www.classcentral.com/course/udemy-complete-vmware-vsphere-esxi-and-vcenter-ad-67823
807,Introduction to SAN and NAS Storage,Udemy,Udemy,On-Demand,Free Online Course,3.6,0,11612,0,https://www.classcentral.com/course/udemy-storageintro-61496
808,Introduction to Computer Networking - Beginner Crash Course,Udemy,Udemy,On-Demand,Paid Course,5.9,0,11851,0,https://www.classcentral.com/course/udemy-networkingbasics-131140
809,Ethereum Blockchain Developer Bootcamp With Solidity (2025),Udemy,Udemy,On-Demand,Paid Course,25.95,0,11565,0,https://www.classcentral.com/course/udemy-blockchain-developer-24007
810,Introducción al Hardware de Computadoras,Udemy,Udemy,On-Demand,Paid Course,2.9,0,436,0,https://www.classcentral.com/course/udemy-mantenimiento-pc-32467
811,Progressive Web Apps (PWA) - The Complete Guide,Udemy,Udemy,On-Demand,Paid Course,15.85,0,11359,0,https://www.classcentral.com/course/udemy-progressive-web-app-pwa-the-complete-guide-25213
812,Windows Server 2019 Administration,Udemy,Udemy,On-Demand,Paid Course,21.26666667,0,11203,0,https://www.classcentral.com/course/udemy-windows-server-2019-administration-h-69523
813,ChatGPT Complete Course - Prompt Engineering for ChatGPT,Udemy,Udemy,On-Demand,Paid Course,5.3,0,11267,0,https://www.classcentral.com/course/udemy-chat-gpt-261260
814,Introduction to Windows PowerShell 5.1,Udemy,Udemy,On-Demand,Paid Course,11.08333333,0,11104,0,https://www.classcentral.com/course/udemy-windows-powershell-training-42291
815,Aprende Informática desde cero,Udemy,Udemy,On-Demand,Free Online Course,1,0,427,0,https://www.classcentral.com/course/udemy-aprende-informatica-desde-cero-124772
816,Introduction to Machine Learning with Pytorch,Udacity,Introduction to Machine Learning with Pytorch,On-Demand,Paid Course,1751.35,4,5,0,https://www.classcentral.com/course/udacity-intro-to-machine-learning-nanodegree--nd229-18201
817,Applied Cryptography,Udacity,"Cryptography is present in everyday life, from paying with a credit card to using the telephone.  Learn all about making and breaking puzzles in computing.",On-Demand,Free Online Course,1344,4,5,0,https://www.classcentral.com/course/udacity-applied-cryptography-326
818,Artificial Intelligence: Reinforcement Learning in Python,Udemy,Udemy,On-Demand,Paid Course,14.71666667,0,10617,0,https://www.classcentral.com/course/udemy-artificial-intelligence-reinforcement-learn-23324
819,Fundamentos y Lógica de Programación 2021,Udemy,Udemy,On-Demand,Paid Course,6,0,418,0,https://www.classcentral.com/course/udemy-logica-de-programacion-2020-nivel-principia-67135
820,Up & Running with ServiceNow,Udemy,Udemy,On-Demand,Paid Course,3.016666667,0,10667,0,https://www.classcentral.com/course/udemy-up-and-running-with-servicenow-2018-68104
821,"Jenkins: Beginner To Pro, Learn CI/CD Pipelines & Automation",Udemy,Udemy,On-Demand,Paid Course,2.316666667,0,10489,0,https://www.classcentral.com/course/udemy-jenkins-masterclass-105628
822,Complete Generative AI Course With Langchain and Huggingface,Udemy,Udemy,On-Demand,Paid Course,54.11666667,0,10288,0,https://www.classcentral.com/course/udemy-complete-generative-ai-course-with-langchai-303868
823,Mastering Algorithms and Data Structures in Python,CodeSignal,CodeSignal,On-Demand,Free Certificate,0,0,905,0,https://www.classcentral.com/course/codesignal-mastering-algorithms-and-data-structures-in-python-361230
824,SQL Server Integration Services (SSIS) - An Introduction,Udemy,Udemy,On-Demand,Paid Course,3.933333333,0,10056,0,https://www.classcentral.com/course/udemy-sql-server-ssis-an-introduction-67149
825,How To Create a Website in a Weekend! (Project-Centered Course),Coursera,"Design, build, and publish a basic website with text, sound, images, hyperlinks, plug-ins, and social media interactivity using WordPress. Learn domain setup, layout design, and mobile optimization.",On-Demand,Free Online Course (Audit),13.66666667,4,7,0,https://www.classcentral.com/course/how-to-create-a-website-5815
826,The Raspberry Pi Platform and Python Programming for the Raspberry Pi,Coursera,"Learn to program and develop IoT devices using Raspberry Pi and Python. Set up the environment, run Linux, write and debug code, and control hardware through GPIO pins.",On-Demand,Free Online Course (Audit),10.93333333,0,2764,0,https://www.classcentral.com/course/raspberry-pi-platform-4334
827,Building AI,Independent,14 reviews,On-Demand,Free Online Course,50,4.5,14,0,https://www.classcentral.com/course/independent-building-ai-22112
828,Introducción a la programación en C: Funciones y punteros,edX,"En este curso aprenderás cómo hacer programas modulares a través de funciones y punteros en el lenguaje de programación C, uno de los más utilizados.",On-Demand,Free Online Course (Audit),20,4,5,0,https://www.classcentral.com/course/c-programming-universidad-autonoma-de-madrid-intr-12158
829,操作系统与虚拟化安全,Coursera,操作系统是计算机系统的基础软件，而系统虚拟化已成为云计算平台的核心技术，没有它们提供的安全性，这些计算机系统及其上数据的安全性都将无法保障。本课程将从理论与工程实践相结合的角度，介绍操作系统(Linux)与系统虚拟化(Xen)安全相关理论、技术和方法，包括：安全概念、安全机制、安全模型、安全体系结构、安全开发方法、安全标准与评测方法等，帮助你深入学习和理解该领域的知识体系、实践技术和方法。,On-Demand,Free Online Course (Audit),28,0,12,0,https://www.classcentral.com/course/osvirtsecurity-2348
830,The Unix Workbench,Coursera,"Explore Unix tools and command line interfaces, learn Bash programming, version control with Git, and cloud computing basics. Gain essential skills for software development and efficient computing.",On-Demand,Free Online Course (Audit),19.36666667,0,1350,0,https://www.classcentral.com/course/unix-8866
831,程序开发项目实践,Coursera,联合腾讯公司设计的搜索引擎项目实践，通过解决实际问题提升编程能力，并有机会与腾讯工程师交流，为就业做准备。,On-Demand,Free Online Course (Audit),6.066666667,0,0,0,https://www.classcentral.com/course/biancheng-suanfa-biye-xiangmu-6384
832,Mastering Algorithms and Data Structures in Java,CodeSignal,CodeSignal,On-Demand,Free Certificate,0,0,757,0,https://www.classcentral.com/course/codesignal-mastering-algorithms-and-data-structures-in-java-361234
833,HTML Email Certificate (Live Online),Noble Desktop,Noble Desktop,On-Demand,"$1,095.00",24,0,259,0,https://www.classcentral.comhttps://www.nobledesktop.com/certificates/email?utm_source=class-central&utm_medium=referral
834,How to Do CS Theory - Lecture 1b: Research Tips for Theoretical Computer Science,YouTube,"Insights and tips for aspiring theoretical computer science researchers, covering research methods, paper writing, presentation skills, and essential resources in the field.",On-Demand,Free Video,0.6,0,0,0,https://www.classcentral.com/classroom/youtube-how-to-do-cs-theory-at-cmu-lecture-1b-of-cs-theory-toolkit-137787
